processed_text,IsToxic
pepper spray cunt run,True
bunch pussy well cry problem escalate stupid shit like,True
inform exactly go fuck try find reliable resource understand believe thing like happen,False
people ferguson loot oly thing goverment care economy fuck n effort stop crooked cop,True
good quality,False
wow,False
welcome new world order,True
hell care people peacefully protest police feels threaten go to act blow fucker face tg follow riot,True
want toss gernade lol course range fucking shit,True
ah memory btw bring firework,False
stuff like reason people associate violence danger black people,True
awesome,False
love lady need strong woman like peggy hubbard,False
peggy m native american love honey,False
huge wisdom ear listen,False
mrs hubbard jamyla bolden die needlessly,False
amen amen sister strong black woman get,False
stand woman speak truth applaud gut young lady,False
peggy bless courage heart thank honesty passion matter whatawoman,False
lady guest speaker al sharpton rally seriously,False
love woman voice matter fuck black live matter,True
s real parent real mother real talk right learn mom voice truth sea bullshit,False
finally black person unbiased opinion incredibly high percentage black life lose extremely small fraction police black people need responsibility violence,True
thank truth speak innocent,False
sad disgrace black people,True
mother tell thing god bless woman,False
gal call spot way ms.peggy way,False
c blk life matter bullshit witch bullshit black people kill period newark nj bullshitb,True
love saem thing peggy stupid ya kill ya self quick stlpd wakeup,False
niggas love victim situation separate black people need,True
oh politician style oratory peggy hubbard short video ring message loud clear listen ok england thankfully gun culture see american scene time know peggy drop hang wring crap tell word write post white house mavbe listen act,False
share woman awesome,False
real black leadership real revolutionary radicalism,False
respect,False
thank voice sanity black community peggy,False
wow! people like thing rightly say pc police offend tag racist truth speak give credence society know speak truth magnifie like elevate people like school board city council mayor state national office,False
navy vet mad respect,False
+ ~ day day ~ + thisisacommentary truth,False
bitch talk people like dylan roof james holmes jar loughner jerad miller tim mcveigh jared loughner jim david adkisson paul hill scott roeder frazi glen miller jr elliot rodger buford o furrow john r houser etc right,True
thank real hear little girl think thing rage medium want promote racial tension black community want talk elephant room like medium music scene promote thug life,False
peggy hero,False
awesome woman,False
think alot black people tired gun violence gang ignorance community want stop yes bad people race s get statement talk thing black commuity people quick bad people race put black want people well care selfs repectful way,False
tip hat class lady speak,False
black people like,False
right black shitter white man,True
obama say exactly lady say instead defend thug clean language,True
proud woman mother stand principle morality plain common sense afraid tide culture wrong path kudo peggy mother kid hattiesburg ms kill police officer stand take responsibility wonderful role model late heroine,False
basically talk black life matter guess loot rioting place asshole rob drug community hit point cnn believe police brutality want reform know s racism know go fucking look black right till black people stand self destruction,False
spread video awesome,False
thank peggy,False
female uncle ruckus,False
damn good,False
m white person think treat fairly blm create bunch bull threaten life make hard cop bad guy maybe draw weapon fast kill spirit hero kill spirit put comply rush burn house type thing bad cop neighborhood gang neighborhood have heat take embolden spirit life matter form racism blm cause feeling black life matter peggy give hope hope intelligence black community maybe live white guy willing join kkk peggy blm,True
agree sista,False
black person thank speak truth black cause trouble dress like idiot bring trouble kill eachother cause crime complain police good glad parent grow properly stay away garbage,True
thank mrs hubbard happy say needs say black allow neighborhood destroy black mother stand count black father ass home help raise child peggy chief fair wind follow sea shipmate slap hear round world need happen lot sister,False
girl listen twice retweete twice gateway pundent youtube god bless ms hubbard god speed vid,False
great video thank peggy,False
brave woman bring tear eye,False
peggy hubbard president,False
respectable woman,False
logic intelligence mixed race intelligent white dna,True
amen tell like sister amen,False
need people like peggy hubbard support mother year common sense,False
think fall love,False
fuck stupid attack police officer expect away response police,True
hear woman love say message valuable thank post,False
hit nail head black life matter guess kill stupid shit like gang loyalty sell drug instead get education able getto hat parent raise chlidren value pride cause one difference drug deal gang banger difference go makeis holiday dinner,False
dear peggy mother run president,False
plenty white people care exact view woman deem racist stop care,False
look deep happen black people black people situation black people hope learn history,False
love woman wish like certainly help cause page,False
cruel mom,False
speak want,False
woman nobel peace prize instead antichrist obama,False
bravo,False
correction black ppl violent ppl planet say true come black black crime shit single race shit happen race globe,True
sure michael brown know killer young girl consider homeboy,False
love peggy,False
yeah say save tax dollar buy part harley ar lolol,False
peggy know fine black woman man like sick tired violence blame thank speak,False
awesome job peggy thank tell truth westandwithpeggyhubbard,False
community march peace hand hand girl kill sit home homework deserve society let maybe al sharpton lead,False
truth deliver courage conviction political correctness reach heart mind honest productive hard work people lady say like,False
right dynamite,False
black speak truth conform norm consider uncle tom sell out,False
day conservative support confederate flag deny racism criticize black people deem hero white people lmao white woman black face screen,True
real strong black woman afraid speak truth,False
peggy love video use stand black life matter excuse away crime know lot good black like voice hear voice silence nationwide uproar black life matter afraid victim,False
okay blacklivesmovent thug stop carp u wanna stand murder child die gettin shoot cheast becasue u wanna act like plant ape movie excuse black kill black u wanna come cop white ppl name rastist name u not try lisene lawa obey law stop shoot inncent ppl benfit u guy kill ppl need jail,True
freakin girl,False
amen peggy hubbard color make difference person inside innocent year old little girl attention people want cause chaos black white go exactly obama want look country mess admire courage tell like peggy hubbard,True
race human race,False
omg put tell truth hard true,False
integration black people school business bank integration lose thing,True
leave,False
wake black people,False
old white conservative say peggy vice president imagine trump hubbard ticket woweee wow,False
pretty woman dang,False
leave video truth hurt thank post video,False
ask fellow white liberal press network blog post will cringe black conservatism,True
say need new part harley lol,False
thank finally powerful voice truth black community black killing perpetrate black black murder non black direct innocent black citizen drug gang relate donald trump star parker hope aware peggy hubbard comment address issue honestly need seat table ms hubbard trump campaign administration race monger like obama eric holder pelosi reid jessie jackson al sharpton naacp congressional black caucus congressional democrat ethnicity level government mainstream medium conspire year turn viable black community government dependent ghetto knowingly advance false narrative systemic white conservative racism great accomplishment destruction black nuclear family percent black child bear single mother married limit number child obama progressive gladly extort taxpayer money care illegitimate child exchange guarantee vote power master plan policy insure generation newly create disaffected dysfunctional adult necessarily democratic voter race hustler mention react way black black killing neighborhood power wipe gang minimize drug use community real hope change happen need black community dependent feel hopeless order maintain power control live good life back people deceive think care think purveyor lie damn lie race issue past year real job like rest,False
peggy tip hat,False
love thug deserve slug,True
body cam air police run day day cop screw,False
powerful blunt force trauma powerful hope word change thinking concern black life misplaced thank share,False
peggy hubbard president,False
agree say trust police will arrest crooked pedophile protect treasonous politican thing military people,True
blacklivesmatter build deceit lie,True
not like generalization rant main point right chris rock say well black people niggaz nigga morn killer get gun street black person mourn loss innocent human life little girl get murder base comment black nigga ratio drop,True
"tell taboo talk news medium will touch foot pole *""""black white crime black sexually assault white woman few black woman sexually assault white man yes boj stat available online anymore state statistic inflammatory certain ethnic group tip iceberg",False
peggy watch life leadership revolution video people smart good mentor think research training great leader great work,False
good honest black people know,False
bam say,False
god bless lady wish people like intelligence god bless little girl lose life thug sad single animal care black life matter ass innocent life matter,False
black man need black life matter message need,False
ms hubbard absolute respect wish run office level get big ball male politician like bravo,False
say peggy message share everybody,False
mansur ball bey thug work fedex house serve warrant video brandish gun shoot illegal police officer st louis pd release datum know shoot kill error ball bey criminal record hubbard illegal go national tv slander ball bey son frankly sue,False
watch rest power trayvon martin story urge watch,False
black people violent,False
thank speak problem black community,False
yea beat white people rob black own store cause massive riot waste money bet you work stop waste people money hope single person get shoot happen sadly,True
blacklivesdontmatt,True
see comment prove backward country,True
police militarize,False
dumb mf,True
stop revolution year pretty good job far,False
feel sorry hapenne think happen gang member kill street cop kill black male know gang menber kill day lose family friend go street scream stop killing police kill black person world stop human,False
burn public storage make sense,False
mad cause quiet lose thi belt,False
good,False
real criminal wall street guy steal money inmate penitentiary dream steal,True
revolution set neighbourhood fire good job burn suburb cop live make homeless achive,True
molotov cocktail local drink want dance dance,False
brown stepfather pant half way,True
trés tote hilar vid grip revolutionary regular poster afro punk massive corporate sponsor revolution start sponsor following multi national corporation ha ha ha virtue signal satire practically write,False
congrat get town flame roll live world hell hole try oh wait cause town garbage probably business market = p,False
white immigrant need europe tbh native americans european settler come boat,True
bunch complete dumb ass,True
ignorance law excuse u.s.c deprivation right color law,False
agree time race war,True
war year war start quarter americans die stop bitch,True
weird white pretext police officer white risk black police officer kill white take year prison white white black equal,False
crime commit riot federal offence federal government ability build unlimited prison,False
michael brown thug god bless thin blue line graduate police academy december,True
people understand say black america good world people respect race like bad,True
people ve wish ve literally burn entire city,True
lol look get,False
scroll comment bunch racist comment look trump supporter sit patiently hate ok seriously lot people say wrong yeah kinda people say black think african american people innocent wrong,False
3:40 milk,False
nice looting protest rioting burn stuff middle night work day,True
hard open fire,True
police shoot black guy black riot black shoot black happen,False
dirty mongrel,True
national guard call hint riot national guard spook rioter,False
tax dollar spanking new cop car,False
police car purposefully leave destroy anger instead business cost destruction car pass state taxpayer,False
police problem protest cause black criminal let forget blame address elephant room,True
peace need find side stubborn relentless peaceful work sit step power day chant concern fear path dark fear lead anger anger lead hate hate lead suffering yoda <3,False
inanimate object police car resilient getting completely flip set fire,False
hate basterd like funny try push flip hacopcarcanstillfightback,True
ferguson protester flip police car | new york times,False
wish car flip crush rioter,True
ameland,True
cop need look video start arrest people,False
show violent protest,False
good job guy raise taxis,False
friend get kill mean burn local home item correct,True
question park cruiser protester,False
point set person fire,False
rip crown vic durable car,False
hate people read read black,True
say black people white people white woman get shoot rubber bullet come day black people help walk,False
truly tragedy death kid way city react way justice make matter bad malcolm x way handle thing dr king way,False
maybe know exact story understand suppose case grown man shoot kid be suppose racial guy let hate anti black anti white w.e forget go police officer shoot innocent kid want justice fckin race moment pick race fckin joke not rat ass black kill white vice versa want know fck police officer walk free empty motherfckin gun child,True
michael brown deserve die intoxicate aggressive attempt reach cops gun,True
experience racism side racist white,False
muslim uk black brother sister america,False
kid hopeless piece shit look bully store owner bad decision get dumb ass shot kill,True
you racist fuck god bless america,True
people see mississippi burn way damn time,False
racist comment hate white,False
fuck need military police civilian like wanna bring new gear dress like soldier strut try look tough,False
let elite divide conquer tactic work want racially divide rise,True
j = kind bandana guy wear light,False
oh man thug life type you're hilarious seriously fuckin riot look dollar pocket knife pawnshop pull pant stop play basstrack 80 sedan rim cost car sit ass office belong criminal life be,True
7:24 7:30 xdddddddddddddddd,False
shooting thing black black people black issue line grown man rob store ignore police order people think ok protest behalf thug respect law yes shame come death not thief alive hear bullshit black get to get to hard street street blah blah blah wear hard living like badge honor honor country hey let steal cigarillo blunt worsen ghetto,True
black prejudice easily,True
remember time race riot race get shoot white cop attack officer wave gun remember huge riot year month old shoot head black kid oh,True
not attack police officer steal store expect,False
0:10 legend yell,False
truth people need realize accept michael browns action bring situation bible say justice serve fast justice people say justice peace word awake scripture head deeply speak wish speak right long believe come right time,False
darude sand storm,False
finish video gaze racist bigot comment section glad human,True
say micheal brown deserve treyvon martin eric garner,False
hmm maybe s depth subject comment section nope bunch degenerate,True
you need stop act like mike brown innocent guy wrong,False
pair work boot steal ferguson riot,True
police use peaceful way need bulletproof vest helmet,False
want justice mob mentality action guilty matter grand jury say matter evidence say let hang near tree officer right need learn speak proper english job big racest white crowd jail,True
mike brown criminal thug fuck,True
5:53 brick hit white pig helmet lmao nice shot hit face,True
fuck mo kansas city,True
mlk see cry,False
race issue police brutality issue time cop like darren wilson send jail group police officer shoot kill homeless white man want leave spot home shoot attack k9s shoot bean bag long dead camera jail problem police ignore bad bad try excuse bad police officer behavior thankful one job right,False
time interview person notice ghetto clearly education preschooler protest incredible stupid stuff dr martin luther king jr disappoint respect ignorant black people like ruin thing victim wake stupid guy one make america look stupid,True
right loot right private property right destroy public property play victim card change,False
yes let destroy property ruin day mad police cunt,True
lol police begining sound like s say moo cow mean cop maybe feel like cop mean cow ^^,False
fergueson resident stupid complain crime police shoot criminal emo tell police leave rioting loot destroy community logic think troll srs,True
time agree police go burn relation agree protest people fucking stupid de evolve,True
look people black life matter like white life mike browns life lawfully end police officer assault mike brown suspect aka mr brown football player ft inch mention high marijuana officer ft inch arm baton gun tell mr brown hand witch evidence show shoot assault officer officer police officer officer stupid officer attack man large time stop think hmmm maybe defend maybe let kill,False
comment vice video extrem case obviously racist seriously,False
people kill cop usa year cop kill country streat protest matter dead man white black comment white people not fuck dead black man not unnecessary dead mater,True
people stupid fuck would't work idea fun loser well oh yeah great work burn auto place people unemployed provide family great work police shoot criminal happen black people definition sheep individual thinker,True
like begining peaceful fucking reporter wear armor xd,True
civilian perspective people fight get shoot go jail cop protect self micheal brown shoot foot away daren wilson`s patrol car way self situation continue conflict reason shoot option like pepper spray tazer,False
7:28 lose shit guy lmao,False
understand lady 1:30 say go article video shooting incident personally think case exaggerated riot looting criminal activity say cause grand jury decision fake crime see opportunity disintegration use decision reason,False
lady 7:30 hahahaha,False
united shit america collapse good,True
people want shoot act like thug threaten police officer effin ridiculous excuse act like asshole oh good job destroy city,True
somebody pick gun kill cop la style,True
police not try shoot leg arm body part immobilize time officer fire weapon deadly force train aim centre mass part body,False
m sick see racist comment shame rascim grow fuck people,True
justice street eye eye kill kill,True
like black racist white ppl consequence nice new world live,True
find insane black people play racist card single little issue coincidental white black situation case race want justice destroy private property looting shop right mind ask justice rob destroy people lively hood time black community think perfectly acceptable black person kill white cop cop follow procedure defend self potential fatal attack angry yeah black guy firearm easily knife value black people white law enforcement officer life equal understand officer defend self attack yes attack,True
black life matter white life matter life matter,False
cuumm dowww heeeeerrrr lol come,False
cop armed civil war machine gun unarmed civilian throw brick fuck united states people america free oppression,True
"sign black life matter parent bury child!"",""justice bet know black person shoot white cop ask person kill black person damn clue marche protest far likely murder black person cop fact fuck sharpton cornell west",True
cop = pig,True
see article case go pretty particular make big scene,False
cop moo people beginning,False
man good fight hope minority not rain national guard look wepon act like war,False
case present grand jury return indictment apparently militarized police state gun unarmed teen time unevolved racist hide white hood hide computer screen police badge,True
darren wilson stand trial prove act self defense jury open court law george zimmerman michael dunn grand jury operate secret trust government trust operate secret,False
black,True
help motherfucker primitive compare white people frustrate live white people compete black africa self assured remind day compete multiculturalism good anybody people throw fit live tax dollar steal white people,True
shoot looter sight,True
vice news dispatch,False
bulllsship vice documentary not focus fact idiot job vent racist paranoia,True
10:11 fucking evidence evidence mean fact suspect armed robbery autopsy report evidence show cop innocent god damn,True
feel thirsty violence knowledge,False
police logic shit brick shoot quick army nuke,True
man stuff like reconsider world hitler alive,True
burn tear gas o.c pepper spray,False
guess get away label title police title label low life thug addict guess bar smh,False
ignorant,False
08:10 dat mask tho,False
lol stupid mooslim,True
fact michael brown legal adult rob store time assault store assault cop assault cop likely shoot racist,False
live final day go bad,False
africa thing cause like like work maybe turn continent,True
sad god control know tired michael derren wrong right god know let judge,False
bunch ignorant fuck try hard turn racial thing racial thing start self defense plane simple attack cop ass go shoot,True
feel black america understand,False
think nit upset white people black people shoot police day ignorant fuck racism nit problem militarized police see police culture sick disrespect police black man use violence well bet logical america fight despite colour skin furgson time bring gun shoot,True
america day come end emigration rate multiply year wealthy individual poor unskilled flood unchecked goodbye america good run,False
not understand black community want rally wanna thug video guy rob store come think protester go home michael brown turd crowd racist hate white community,True
11:21 lmao agree rioting violent protest good stuff,False
like hurr instead,False
thing think people forget riot ferguson human combat mind wrap race focus people,False
thank obama,True
possibly people unbelievably ignorant,False
stage event fake riot divid conquer fake news,False
people ask peace riot bring violence,False
0:05 0:18 idea cop moo think oink learn new day,True
reason ram move los angeles,False
9:41 dem big ass gun,True
black year ago shoot police drive friend partying illegal drug use car didn't notice cop car light go freak pull panic cop bright light try desperately hide drug hear cop tell car keep try hide drug course see go center console maybe gun? tell loudly stop hand car tell freeze exactly tell listen shoot likely head understand cop tell hand hand tell step step defy person gun threaten shoot color,False
hatred people,False
dat tuff,False
remember michael brown young teen boy happen build like linerbacker rob convenience store pillar community,False
point try black equal opportunity ferguson suggest city counsel young black man woman job black black people ferguson treat unfairly law enforcement suggest black community law bide citizen break law white people cop arrest black citizen fun sport know true reason black community riot looting ask rioting looting break knoxville young white couple kidnap brutally rap eventually murder black man woman wonder come racism plain stupidity mr brown angel study fact stay away emotion skin color,False
lot disgusting people comment try rationalize casual racism poor understanding context,False
white ferguson let nice east st louis detroit baltimore thing happen look city,True
find channel favs thank u vid r excellent,False
remember send national defence,False
stat don`t represent problem race bait attitude who`s crime ohh bet trayvon little innocent boy don`t speak lisp sure sign left wing democrat,True
quote mother wow hit hard accurate,False
video racist,False
god narrator annoying lisp,False
